{
  "schemaVersion": "1.0",
  "id": "preset-machine-learning",
  "title": "Machine Learning and Neural Networks",
  "description": "A deterministic source-grounded demo graph covering optimization, neural networks, generalization, and evaluation.",
  "domain": "Machine Learning",
  "createdAt": "2026-07-21T00:00:00.000Z",
  "clusters": [
    {
      "id": "foundations",
      "label": "Foundations",
      "description": "Objectives, inputs, and preprocessing."
    },
    {
      "id": "calculus",
      "label": "Calculus",
      "description": "Derivative rules underlying learning."
    },
    {
      "id": "optimization",
      "label": "Optimization",
      "description": "Algorithms and update behavior."
    },
    {
      "id": "neural-networks",
      "label": "Neural Networks",
      "description": "Layered models and gradient propagation."
    },
    {
      "id": "generalization",
      "label": "Generalization",
      "description": "Performance beyond the training set."
    },
    {
      "id": "evaluation",
      "label": "Evaluation",
      "description": "Data splits, metrics, and model selection."
    }
  ],
  "nodes": [
    {
      "id": "ml-loss-functions",
      "label": "Loss Functions",
      "cluster": "Foundations",
      "summary": "A loss function quantifies the discrepancy between a model's prediction and the target, providing the objective optimized during training.",
      "latex": "\\mathcal{L}(\\theta)=\\frac{1}{n}\\sum_{i=1}^{n}\\ell(f_\\theta(x_i),y_i)",
      "difficulty": 0.35,
      "importance": 0.95,
      "initialMastery": 0.72,
      "sourceSpans": [
        {
          "sourceId": "preset-p3-loss",
          "page": 3,
          "section": "2.1 Objective Functions",
          "quote": "Training minimizes an empirical loss that measures prediction error over observed examples."
        }
      ],
      "question": "What role does a loss function play during model training?",
      "rubric": {
        "requiredConcepts": [
          "quantifies prediction error",
          "optimization objective"
        ],
        "optionalConcepts": [
          "parameters",
          "training examples"
        ],
        "misconceptions": [
          "it directly changes labels",
          "it is only an evaluation metric after training"
        ],
        "acceptedKeywords": [
          "error",
          "objective",
          "minimize",
          "prediction"
        ],
        "referenceAnswer": "It measures prediction error and defines the objective the optimizer minimizes to update model parameters."
      },
      "tags": [
        "objective",
        "training"
      ]
    },
    {
      "id": "ml-gradient",
      "label": "Gradients",
      "cluster": "Optimization",
      "summary": "A gradient is the vector of partial derivatives indicating the direction of steepest increase of a scalar objective.",
      "latex": "\\nabla_\\theta \\mathcal{L}=\\left[\\frac{\\partial \\mathcal{L}}{\\partial \\theta_1},\\ldots,\\frac{\\partial \\mathcal{L}}{\\partial \\theta_d}\\right]",
      "difficulty": 0.4,
      "importance": 0.92,
      "initialMastery": 0.62,
      "sourceSpans": [
        {
          "sourceId": "preset-p4-gradient",
          "page": 4,
          "section": "2.2 Gradients",
          "quote": "The gradient collects partial derivatives and points toward the steepest local increase of the loss."
        }
      ],
      "question": "What information does the gradient provide about a loss function?",
      "rubric": {
        "requiredConcepts": [
          "partial derivatives",
          "direction of steepest increase"
        ],
        "optionalConcepts": [
          "magnitude",
          "parameters"
        ],
        "misconceptions": [
          "it always points to the global minimum"
        ],
        "acceptedKeywords": [
          "partial derivative",
          "steepest",
          "direction",
          "increase"
        ],
        "referenceAnswer": "The gradient contains partial derivatives with respect to parameters and points in the direction of steepest local increase."
      },
      "tags": [
        "calculus",
        "optimization"
      ]
    },
    {
      "id": "ml-gradient-descent",
      "label": "Gradient Descent",
      "cluster": "Optimization",
      "summary": "Gradient descent iteratively updates parameters opposite the loss gradient to reduce the objective.",
      "latex": "\\theta_{t+1}=\\theta_t-\\eta\\nabla_\\theta\\mathcal{L}(\\theta_t)",
      "difficulty": 0.45,
      "importance": 0.98,
      "initialMastery": 0.82,
      "sourceSpans": [
        {
          "sourceId": "preset-p4-gd",
          "page": 4,
          "section": "2.3 Gradient Descent",
          "quote": "Parameters are moved opposite the gradient, scaled by a learning rate, to decrease the loss."
        }
      ],
      "question": "Why does gradient descent subtract the gradient from the current parameters?",
      "rubric": {
        "requiredConcepts": [
          "gradient points toward increase",
          "subtracting moves toward lower loss"
        ],
        "optionalConcepts": [
          "learning rate",
          "local"
        ],
        "misconceptions": [
          "the gradient directly gives the global minimum"
        ],
        "acceptedKeywords": [
          "opposite",
          "decrease",
          "loss",
          "learning rate"
        ],
        "referenceAnswer": "Because the gradient points toward steepest local increase, subtracting it moves parameters toward lower loss."
      },
      "tags": [
        "optimizer",
        "learning-rate"
      ]
    },
    {
      "id": "ml-learning-rate",
      "label": "Learning Rate",
      "cluster": "Optimization",
      "summary": "The learning rate controls the step size of parameter updates and trades off speed against stability.",
      "latex": "\\Delta\\theta=-\\eta\\nabla_\\theta\\mathcal{L}",
      "difficulty": 0.35,
      "importance": 0.9,
      "initialMastery": 0.52,
      "sourceSpans": [
        {
          "sourceId": "preset-p5-lr",
          "page": 5,
          "section": "2.4 Learning Rate",
          "quote": "A step size that is too large may diverge, while one that is too small can make optimization slow."
        }
      ],
      "question": "What can happen when the learning rate is too large or too small?",
      "rubric": {
        "requiredConcepts": [
          "too large can overshoot or diverge",
          "too small learns slowly"
        ],
        "optionalConcepts": [
          "stability",
          "convergence"
        ],
        "misconceptions": [
          "a larger learning rate is always better"
        ],
        "acceptedKeywords": [
          "overshoot",
          "diverge",
          "slow",
          "step size"
        ],
        "referenceAnswer": "A learning rate that is too large can overshoot or diverge, while one that is too small makes convergence slow."
      },
      "tags": [
        "hyperparameter",
        "optimization"
      ]
    },
    {
      "id": "ml-chain-rule",
      "label": "Chain Rule",
      "cluster": "Calculus",
      "summary": "The chain rule differentiates compositions by multiplying derivatives along the dependency path.",
      "latex": "\\frac{d}{dx}f(g(x))=f'(g(x))g'(x)",
      "difficulty": 0.5,
      "importance": 0.94,
      "initialMastery": 0.32,
      "sourceSpans": [
        {
          "sourceId": "preset-p8-chain",
          "page": 8,
          "section": "3.1 Chain Rule",
          "quote": "Derivatives through composed functions are products of local derivatives along the computation."
        }
      ],
      "question": "Why is the chain rule essential for training multilayer neural networks?",
      "rubric": {
        "requiredConcepts": [
          "network is a composition of functions",
          "propagates derivatives through layers"
        ],
        "optionalConcepts": [
          "local derivatives",
          "gradient"
        ],
        "misconceptions": [
          "it updates weights without derivatives"
        ],
        "acceptedKeywords": [
          "composition",
          "layers",
          "derivative",
          "propagate"
        ],
        "referenceAnswer": "A neural network composes many functions, so the chain rule propagates derivatives through each layer to compute parameter gradients."
      },
      "tags": [
        "calculus",
        "backpropagation"
      ]
    },
    {
      "id": "ml-computational-graph",
      "label": "Computational Graphs",
      "cluster": "Neural Networks",
      "summary": "A computational graph represents operations and dependencies, enabling systematic forward evaluation and reverse differentiation.",
      "difficulty": 0.48,
      "importance": 0.86,
      "initialMastery": 0.42,
      "sourceSpans": [
        {
          "sourceId": "preset-p9-compgraph",
          "page": 9,
          "section": "3.2 Computational Graphs",
          "quote": "Operations become nodes and values flow along edges, making dependencies explicit for differentiation."
        }
      ],
      "question": "How does a computational graph help calculate neural-network gradients?",
      "rubric": {
        "requiredConcepts": [
          "represents operations and dependencies",
          "supports reverse traversal or differentiation"
        ],
        "optionalConcepts": [
          "intermediate values",
          "chain rule"
        ],
        "misconceptions": [
          "it is only a visualization and has no role in differentiation"
        ],
        "acceptedKeywords": [
          "operations",
          "dependencies",
          "reverse",
          "gradient"
        ],
        "referenceAnswer": "It records operations and dependencies so reverse traversal can combine local derivatives using the chain rule."
      },
      "tags": [
        "autodiff",
        "graph"
      ]
    },
    {
      "id": "ml-backpropagation",